<?xml version="1.0" encoding="UTF-8"?>
<?xml-stylesheet type="text/xsl" ?>
<casaxml xmlns="http://casa.nrao.edu/schema/psetTypes.html"
xmlns:xsi="http://www.w3.org/2001/XMLSchema-instance"
xsi:schemaLocation="http://casa.nrao.edu/schema/casa.xsd
file:///opt/casa/code/xmlcasa/xml/casa.xsd">


<task type="function" name="importnro" category="single dish, import/export" >

  <shortdescription>Convert NOSTAR data into a CASA visibility file (MS)</shortdescription>

  <input>

    <param type="string" name="infile" mustexist="true">
          <description>Name of input NOSTAR data</description>
          <value></value>
    </param>

    <param type="string" name="outputvis" kind="ms">
          <description>Root name of the ms to be created. Note the .ms is NOT added </description>
          <value></value>
    </param>

    <param type="bool" name="overwrite">
	    <description>Over write an existing MS(s)</description>
	    <value>False</value>
    </param>

    <param type="bool" name="parallel">
	    <description>Turn on parallel execution</description>
	    <value>False</value>
    </param>

    </input>

  <returns type="bool"/>

  <example>
Keyword arguments:
asdm -- Name of input NOSTAR data
        default: none; example: asdm='mydata.Y'

outputvis -- Root ms name. Note that a prefix (.ms) is NOT appended to this name.
             default: none; example outputvis='myms.ms'

overwrite -- overwrite an existing MS
             default: False (do not overwrite)

parallel  -- Turn on parallel execution
             default: False (serial execution)
  </example>

</task>

</casaxml>
