<casaxml xsi:schemaLocation="http://casa.nrao.edu/schema/casa.xsd     file:///opt/casa/code/xmlcasa/xml/casa.xsd" xmlns:xsi="http://www.w3.org/2001/XMLSchema-instance" xmlns="http://casa.nrao.edu/schema/psetTypes.html">

    <task category="import/export" name="importvla" type="function">
importvla(archivefiles=None,vis=None,
              bandname=None,frequencytol=None,
              project=None,
              starttime=None,stoptime=None,
              applytsys=None,
              autocorr=None,antnamescheme=None):
  <shortdescription>Import VLA archive file(s) to a measurement set</shortdescription>
<description>
Imports an arbitrary number of VLA archive-format data sets into a
casa measurement set.  If more than one band is present, they will be
put in the same measurement set but in a separate spectral window.
The task will handle old style and new style VLA (after July 2007)
archive data and apply the tsys to the data and to the weights.
</description>
   <input>
       <param mustexist="true" name="archivefiles" type="pathVec">
<shortdescription>Name of input VLA archive file(s)</shortdescription>
<description>Name of input VLA archive file(s)
                     Default: none.  Must be supplied

                        Examples: 
                        archivefiles = 'AP314_A959519.xp1'
                        archivefiles=['AP314_A950519.xp1',
                        'AP314_A950519.xp2']
</description>
           <value/>
       </param>

       <param name="vis" type="string">
<shortdescription>Name of output visibility file</shortdescription>
<description>Name of output visibility file
                     Default: none.  Must be supplied

                        Example: vis='NGC7538.ms'

                     NOTE: Will not over-write existing ms of same
                     name. A backup flag-file version 'Original' will
                     be made in vis.flagversions.  See help
                     flagmanager.
 </description>
           <value/>
       </param>

       <param name="bandname" type="string">
<shortdescription>VLA frequency band name:\'\'=&gt;obtain all bands in the archive file</shortdescription>
<description>VLA frequency band name:
                     Default: '' (obtain all bands in the archive
                     file)
                     Options: '4'=48-96 MHz,'P'=298-345
                     MHz,'L'=1.15-1.75 GHz, 'C'=4.2-5.1
                     GHz,'X'=6.8-9.6 GHz,'U'=13.5-16.3 GHz,
                     'K'=20.8-25.8 GHz,'Q'=38-51 GHz

                        Example: bandname='K'
</description>
           <value/>
           <allowed kind="enum">
               <value>4</value>
               <value>P</value>
               <value>L</value>
               <value>S</value>
               <value>C</value>
               <value>X</value>
               <value>U</value>
               <value>K</value>
               <value>Ka</value>
               <value>Q</value>
               <value/>
           </allowed>
       </param>

       <param name="frequencytol" type="any">
<shortdescription>Frequency shift to define a unique spectra window (Hz)</shortdescription>
<description>Tolerance in frequency shift in making spectral windows
                     Default: = 150000.0Hz'

                        Example: frequencytol = 1500000.0 (units = Hz)

                     For Doppler shifted data, less than 10000 Hz may
                     may produce too many unnecessary spectral
                     windows.
</description>
           <value type="string">150000.0Hz</value>
       </param>

       <param name="project" type="string">
<shortdescription>Project name: \'\' =&gt; all projects in files</shortdescription>
<description>Project name to import from archive files
                     Default: '' (all projects in file)

                        Example: project='AL519'             
                        Project = 'al519' or AL519 will work. 

                     WARNING: Do not include leading zeros; project =
                     'AL0519' will not work.
</description>
           <value/>
       </param>

       <param name="starttime" type="string">
<shortdescription>Start time to search for data</shortdescription>
<description>Time after which data will be considered for importing
                     Default: '' (all)

                     syntax: starttime = '2003/1/31/05:05:23'. Date
                     must be included!
</description>
           <value/>
       </param>

       <param name="stoptime" type="string">
<shortdescription>End time to search for data</shortdescription>
<description>Time before which data will be considered for
importing
                     Default: '' (all)

                     syntax: starttime = '2003/1/31/08:05:23'. Date
                     must be included!
</description>
           <value/>
       </param>

       <param name="applytsys" type="bool">
<shortdescription>Apply nominal sensitivity scaling to data and weights</shortdescription>
<description>Apply data scaling and weight scaling by nominal
sensitivity (~Tsys)
                     Default: True (strongly recommended)
                     Options: True|False
</description>
           <value>True</value>
       </param>

       <param name="autocorr" type="bool">
<shortdescription>Import autocorrelations to MS, if set to True</shortdescription>
<description>Import autocorrelations to MS
                     Default: False (no autocorrelations)
                     Options: False|True
</description>
           <value>False</value>
       </param>


       <param name="antnamescheme" type="string">
<shortdescription>\'old\' or \'new\'; \'VA04\' or \'04\' for VLA ant 4</shortdescription>
<description>'old' or 'new' antenna names.
                     Default: 'new'
                     Options: new|old

                     * 'new' gives antnenna names 'VA04' or 'EA13 for
                       VLA telescopse 04 and 13 (EVLA)
                     * 'old' gives names '04' or '13'
</description>
           <value>new</value>
           <allowed kind="enum">
               <value>old</value>
               <value>new</value>
           </allowed>
       </param>

       <param name="keepblanks" type="bool">
<shortdescription>Fill scans with blank (empty) source names (e.g. tipping scans)</shortdescription>
<description>Should sources with blank names be filled into the data
base?
                     Default: False (do not fill)
                     Options: False|True

                     These scans are tipping scans (as of June 1,
                     2009) and should not be filled in the visibility
                     data set.
</description>
           <value>False</value>
       </param>

       <param name="evlabands" type="bool">
<shortdescription>Use updated eVLA frequencies and bandwidths for bands and wavelengths</shortdescription>
<description>Use the EVLA's center frequency and bandwidths for
frequencies specified via wavelength or band.
                     Default: False
                     Options: False|True
</description>
           <value>False</value>
       </param>
   </input>
   <example>
FOR MORE INFORMATION, SEE THE TASK PAGES OF IMPORTVLA IN CASA DOCS:
https://casa.nrao.edu/casadocs/
   </example>
<returns>void</returns></task>
</casaxml>
