<casaxml xsi:schemaLocation="http://casa.nrao.edu/schema/casa.xsd       file:///opt/casa/code/xmlcasa/xml/casa.xsd" xmlns:xsi="http://www.w3.org/2001/XMLSchema-instance" xmlns="http://casa.nrao.edu/schema/psetTypes.html">

      <task category="import/export" name="importuvfits" type="function">
    <shortdescription>Convert a UVFITS file to a CASA visibility data set</shortdescription>
    <description>Convert a UVITS file to a CASA visiblity data set.
                Don\'t forget to flag autocorrelations using taskname flagdata, autocorr = true
    </description>
    <input>
        <param name="fitsfile" mustexist="true" type="string"><shortdescription>Name of input UV FITS file</shortdescription><description>Name of input UV FITS file</description>
            
            <value/>
        </param>

        <param name="vis" type="string"><shortdescription>Name of output visibility file (MS)</shortdescription><description>Name of output visibility file (MS)</description>
            
            <value/>
        </param>
        <param name="antnamescheme" type="string"><shortdescription>VLA/EVLA/CARMA only; \'new\' or \'old\'; \'VA04\' or \'04\' for VLA ant 4</shortdescription><description>VLA/EVLA/CARMA only; \'new\' or \'old\'; \'VA04\' or \'04\' for VLA ant 4</description>
                  
          <value>old</value>
          <allowed kind="enum">
          <value>old</value>
          <value>new</value>
          </allowed>
        </param>
    </input>

<example>
        Convert a UVFITS file to a CASA visibility data set:

        Keyword arguments:
        fitsfile -- Name of input UV FITS file
                default = none; example='3C273XC1.fits'
        vis -- Name of output visibility file (MS)
                default = none; example: vis='3C273XC1.ms'
        antnamescheme -- Naming scheme for VLA/JVLA/CARMA antennas
                default = old;
                  old: Antenna name is a number, '04'
                       This option exists for backwards compatibility
                       but can lead to ambiguous results when antenna
                       indices are used for data selection.
                  new: Antenna name is not a number, e.g., 'VA04' or 'EA04'
                       With this scheme, data selection via
                       antenna names and indices is non-ambiguous.

        Note: Don't forget to flag autocorrections using
           taskname flagdata, autocorr = true

 </example>
 </task>
 </casaxml>