<?xml version="1.0" encoding="UTF-8"?>
<?xml-stylesheet type="text/xsl" ?>
<casaxml xmlns="http://casa.nrao.edu/schema/psetTypes.html"
      xmlns:xsi="http://www.w3.org/2001/XMLSchema-instance"
      xsi:schemaLocation="http://casa.nrao.edu/schema/casa.xsd
      file:///opt/casa/code/xmlcasa/xml/casa.xsd">

      <task type="function" name="importfits" category="import/export">
    <shortdescription>Convert an image FITS file into a CASA image</shortdescription>
<description>
Convert an image FITS file into a CASA image
</description>
    <input>
        <param type="string" mustexist="true" name="fitsimage">
<shortdescription>Name of input image FITS file</shortdescription>
<description>Name of input image FITS file
                     Default: none

                        Example: fitsimage='3C273XC1.fits'
</description>
            <value></value>
        </param>

        <param type="string" name="imagename">
<shortdescription>Name of output CASA image</shortdescription>
<description>Name of output CASA image
                     Default: none

                        Example: fitsimage='3C273XC1.image'
</description>
            <value></value>
        </param>

        <param type="int" name="whichrep">
<shortdescription>If fits image has multiple coordinate reps, choose one.</shortdescription>
<description>If fits image has multiple coordinate reps, choose one.
                     Default: 0 (means first)

                        Example: whichrep=1
</description>
            <value>0</value>
        </param>

        <param type="int" name="whichhdu">
<shortdescription>If fits file contains multiple images, choose one (0 = first HDU, -1 = first valid image).</shortdescription>
<description>If fits file contains multiple images, choose one
                     Default: -1 (use the first valid one)

                     NOTE: 0 = first HDU, -1 = first valid image

                        Example: whichhdu=1
</description>
            <value>-1</value>
        </param>

        <param type="bool" name="zeroblanks">
<shortdescription>Set blanked pixels to zero (not NaN)</shortdescription>
<description>Set blanked pixels to zero (not NaN)
                     Default: True
                     Options: True|False
</description>
            <value>True</value>
        </param>

        <param type="bool" name="overwrite">
<shortdescription>Overwrite output file if it exists?</shortdescription>
 <description>Overwrite output file if it exists?
                     Default: False
                     Options: False|True
</description>
            <value>False</value>
        </param>

        <param type="bool" name="defaultaxes">
<shortdescription>Add the default 4D coordinate axes where they are missing; value True requires setting defaultaxesvalues</shortdescription>
<description>Add the default 4D coordinate axes where they are
missing
                     Default: False
                     Options: False|True

                     IMPORTANT: value True requires setting defaultaxesvalues
</description>
            <value>False</value>
        </param>

        <param type="variant" name="defaultaxesvalues">
<shortdescription>List of values to assign to added degenerate axes when defaultaxes==True (ra,dec,freq,stokes)</shortdescription>
<description>List of values to assign to added degenerate axes when
defaultaxes==True (ra,dec,freq,stokes)
                     Default: []

                     For existing axes, empty strings can be given as
                     values. For the directions and spectral values,
                     any valid angle/frequency expressions can be
                     given.

                        Example: defaultaxesvalues=['19h30m00',
                        '-02d30m00', '88.5GHz', 'Q'] 
</description>
            <value>[]</value>
        </param>

        <param type="variant" name="beam">
<shortdescription>List of values to be used to define the synthesized beam [BMAJ,BMIN,BPA] (as in the FITS keywords)</shortdescription>
<description>List of values to be used to define the synthesized beam
[BMAJ,BMIN,BPA] (as in the FITS keywords)
                     Default: [] (i.e.take from FITS file)

                        Example: beam=['0.35arcsec', '0.24arcsec',
                        '25deg']
</description>
            <value>[]</value>
        </param>
    </input>

<example>
FOR MORE INFORMATION, SEE THE TASK PAGES OF IMPORTFITS IN CASA DOCS:
https://casa.nrao.edu/casadocs/
 </example>
 </task>
 </casaxml>
