<?xml version="1.0" encoding="UTF-8"?>
<?xml-stylesheet type="text/xsl" ?>

<casaxml xmlns="http://casa.nrao.edu/schema/psetTypes.html"
xmlns:xsi="http://www.w3.org/2001/XMLSchema-instance"
xsi:schemaLocation="http://casa.nrao.edu/schema/casa.xsd
file:///opt/casa/code/xmlcasa/xml/casa.xsd">


<!-- This is the image continuum subtraction task                           -->
<!-- step 1: construct region with the region manger tool, rg               -->
<!-- step 2: do the subtraction, with ia.continuumsub (image analysis tool) -->
<!--                                                                        -->
<!-- TODO: Expand region selection                                          -->

<task type="function" name="imcontsub" category="analysis, imaging">
<shortdescription>Estimates and subtracts continuum emission from an image cube</shortdescription>
<description>
Estimates and subtracts continuum emission from an image cube

For each direction pixel (x, y) column in imagename (or a subset
selected by region and/or box), this estimates the continuum by
fitting a polynomial to one or more subsets of the channels.  The
continuum estimate is saved in contfile, and subtracted from imagename
(or its subset) to make a spectral line estimate, which is saved in
linefile.
</description>
<input>
    <param type="string" name="imagename" mustexist="true" >
<shortdescription>Name of the input spectral line image</shortdescription>
<description>Input image cube.
                     Default: none

                        Example: imagename='ngc5921_task.im'
</description>
        <value></value>
        <example>inputfile=ngc5921_task.image</example>
    </param>

    <param type="string" name="linefile" >
<shortdescription>Output continuum-subtracted image file name</shortdescription>
<description>Name of continuum-subtracted output spectral line cube
                     Default: none

                        Example: outline='ngc5921_line.im'
</description>
        <value></value>
        <example>outline=ngc5921_line.image</example>
    </param>

    <param type="string" name="contfile" >
<shortdescription>Output continuum image file name</shortdescription>
<description>Name of output continuum cube
                     Default: none

                        Example: contfile='ngc5921_cont.im'
</description>
        <value></value>
        <example>outcont=ngc5921_cont.image</example>
    </param>

    <param type="int" name="fitorder" >
<shortdescription>Polynomial order for the continuum estimation</shortdescription>
<description>Polynomial order for the continuum estimation
                     Default: 0

                        Example: fitorder=2
</description>
        <value>0</value>
    <allowed kind="range"><value range="min">0</value></allowed> 
        <example>fitorder=2</example>
    </param>

    <param type="string" name="region">
<shortdescription>Region selection.</shortdescription>
<description>Region selection. 
                     Default: '' (use the full image)
</description>
        <value/>
    </param>
    <param type="any" name="box">
<shortdescription>Rectangular region to select in direction plane. Default is to use the entire direction plane.</shortdescription>
<description>Rectangular region to select in direction plane.
                     Default: '' (use the entire direction plane)
</description>
        <any type="variant" limittypes="string intArray stringArray"/>
        <value type="string"/>
    </param>
    <param type="string" name="chans" >
<shortdescription>Channels to use.</shortdescription>
<description>Channels to use. 
                     Default: '' (use all channels)
</description>
        <value/>
    </param>
    <param type="string" name="stokes">
<shortdescription>Stokes planes to use.</shortdescription>
<description>Stokes planes to use.
                     Default: '' (use all Stokes planes)
</description>
        <value/>
    </param>

    <constraints>
    </constraints>
</input>
<returns type="void"/>



<example>
FOR MORE INFORMATION, SEE THE TASK PAGES OF IMCONTSUB IN CASA DOCS:
https://casa.nrao.edu/casadocs/
</example>
</task>
</casaxml>
