<?xml version="1.0" encoding="UTF-8"?>
<?xml-stylesheet type="text/xsl" ?>
<casaxml xmlns="http://casa.nrao.edu/schema/psetTypes.html"
      xmlns:xsi="http://www.w3.org/2001/XMLSchema-instance"
      xsi:schemaLocation="http://casa.nrao.edu/schema/casa.xsd
      file:///opt/casa/code/xmlcasa/xml/casa.xsd">

<task type="function" name="polfromgain" category="calibration">
        <shortdescription>Derive linear polarization from gain ratio</shortdescription>
        <description>
          TBD
        </description>
        <input>
                <param type="string" name="vis" mustexist="true">
                        <description>Name of input visibility file (MS)</description>
                        <value></value>
                </param>

                <param type="string" name="tablein" mustexist="true">
                        <description>Input calibration table</description>
                        <value></value>
                </param>

                <param type="string" name="caltable">
                        <description>Output calibration table (forces polarization correction if specified)</description>
                        <value></value>
                </param>

                <param type="double" name="paoffset">
                        <description>Manual position angle offset</description>
                        <value>0.0</value>
                </param>

        </input>
<returns type="void"/>

<example>


        TBD...

        Keyword arguments:
        vis -- Name of input visibility file
                default: none; 
        tablein -- Input calibration table (G or T)
                default: none; 
        caltable -- Output calibration table
                default: ''  (no new table)
                if specified, new caltable with polarization removed is generated
        paoffset -- Manual position angle offset
              default: 0.0  (no extra offset)
              example: paoffset=10.0  (10 degree offset)

 </example>
 </task>
 </casaxml>
