<casaxml xsi:schemaLocation="http://casa.nrao.edu/schema/casa.xsd file:///opt/casa/code/xmlcasa/xml/casa.xsd" xmlns="http://casa.nrao.edu/schema/psetTypes.html" xmlns:xsi="http://www.w3.org/2001/XMLSchema-instance">

<task type="function" name="sdpolaverage" category="single dish">
     <shortdescription>Average SD spectra over polarisation</shortdescription>

<description>
    
    The task sdpolaverage exports data averaged over different polarisations.
    Scope of this task is to obtain Stokes I from orthogonal autocorrelation 
    pairs (XXYY/LLRR). Available options include:

    * '' (blank string as the default: polarisation averaging turned off)
    * stokes
    * geometric

</description>

<input>
    <param type="path" name="infile" mustexist="true"><shortdescription>name of input SD dataset</shortdescription><description>name of input SD dataset</description>
        
        <value/>
    </param>
    
    <param type="string" name="datacolumn" ignorecase="true"><shortdescription>name of data column to be used [&quot;data&quot;, &quot;float_data&quot;, or &quot;corrected_data&quot;]</shortdescription><description>name of data column to be used [&quot;data&quot;, &quot;float_data&quot;, or &quot;corrected_data&quot;]</description>
        
        <value>data</value>
    </param>

    <param type="string" name="antenna"><shortdescription>select data by antenna name or ID, e.g. &quot;PM03&quot;</shortdescription><description>select data by antenna name or ID, e.g. &quot;PM03&quot;</description>
        
        <value/>
    </param>
    
    <param type="string" name="field"><shortdescription>select data by field IDs and names, e.g. &quot;3C2*&quot; (&quot;&quot;=all)</shortdescription><description>select data by field IDs and names, e.g. &quot;3C2*&quot; (&quot;&quot;=all)</description>
        
        <value/>
    </param>

    <param type="string" name="spw"><shortdescription>select data by IF IDs (spectral windows), e.g. &quot;3,5,7&quot; (&quot;&quot;=all)</shortdescription><description>select data by IF IDs (spectral windows), e.g. &quot;3,5,7&quot; (&quot;&quot;=all)</description>
        
        <value/>
    </param>
    
    <param type="string" name="timerange"><shortdescription>select data by time range, e.g. &quot;09:14:0~09:54:0&quot; (&quot;&quot;=all) (see examples in help)</shortdescription><description>select data by time range, e.g. &quot;09:14:0~09:54:0&quot; (&quot;&quot;=all) (see examples in help)</description>
        
        <value/>
    </param>
    
    <param type="string" name="scan"><shortdescription>select data by scan numbers, e.g. &quot;21~23&quot; (&quot;&quot;=all)</shortdescription><description>select data by scan numbers, e.g. &quot;21~23&quot; (&quot;&quot;=all)</description>
        
        <value/>
    </param>

    <param type="string" name="intent"><shortdescription>select data by observational intent, e.g. &quot;*ON_SOURCE*&quot; (&quot;&quot;=all)</shortdescription><description>select data by observational intent, e.g. &quot;*ON_SOURCE*&quot; (&quot;&quot;=all)</description>
        
        <value/>
    </param>

    <param type="string" name="polaverage"><shortdescription>polarization averaging mode (&quot;&quot;, &quot;stokes&quot; or &quot;geometric&quot;).</shortdescription><description>polarization averaging mode (&quot;&quot;, &quot;stokes&quot; or &quot;geometric&quot;).</description>
        
        <allowed kind="enum">
            <value/>
            <value>stokes</value>
            <value>geometric</value>
        </allowed>
        <value/>
    </param>

    <param type="string" name="outfile"><shortdescription>name of output file</shortdescription><description>name of output file</description>
        
        <value/>
    </param>
</input>

<example>  
-----------------
Keyword arguments
-----------------
infile -- name of input SD dataset
datacolumn -- name of data column to be used
        options: 'data', 'float_data', or 'corrected_data'
        default: 'data'
antenna -- select data by antenna name or ID
        default: '' (use all antennas)
        example: 'PM03'
field -- select data by field IDs and names
        default: '' (use all fields)
        example: field='3C2*' (all names starting with 3C2)
                 field='0,4,5~7' (field IDs 0,4,5,6,7)
                 field='0,3C273' (field ID 0 or field named 3C273)
        this selection is in addition to the other selections to data
spw -- select data by IF IDs (spectral windows)/channels
        default: '' (use all IFs and channels)
        example: spw='0~2,4'; spectral windows 0,1,2,4 (all channels)
                 spw='&lt;2';  spectral windows less than 2 (i.e. 0,1)
                 spw='0:5~61'; spw 0, channels 5 to 61
                 spw='0,10,3:3~45'; spw 0,10 all channels, spw 3 - chans 3 to 45.
                 spw='0~2:2~6'; spw 0,1,2 with channels 2 through 6 in each.
                 spw = '*:3~64'  channels 3 through 64 for all sp id's
                 spw = ' :3~64' will NOT work.

                 NOTE: sdpolaverage does not support multiple channel ranges 
                       per spectral window (';') just like mstransform doesn't.
        this selection is in addition to the other selections to data
timerange -- select data by time range
        default: '' (use all)
        example: timerange = 'YYYY/MM/DD/hh:mm:ss~YYYY/MM/DD/hh:mm:ss'
                 Note: YYYY/MM/DD can be dropped as needed:
                 timerange='09:14:00~09:54:00' # this time range
                 timerange='09:44:00' # data within one integration of time
                 timerange='&gt;10:24:00' # data after this time
                 timerange='09:44:00+00:13:00' #data 13 minutes after time
        this selection is in addition to the other selections to data
scan -- select data by scan numbers
        default: '' (use all scans)
        example: scan='21~23' (scan IDs 21,22,23)
        this selection is in addition to the other selections to data
intent -- select data by observational intent, also referred to as 'scan intent'
        default: '' (use all scan intents)
        example: intent='*ON_SOURCE*' (any valid scan-intent expression accepted by the MSSelection module can be specified)
        this selection is in addition to the other selections to data
polaverage -- polarization averaging mode
        default: '' (no averaging over polarization)
        options: '', 'stokes', 'geometric'
outfile -- name of output file


-------
POLARIZATION AVERAGE
-------
Two modes of polarization averaging are available. The default is 
'stokes' which is an average based on a formulation of Stokes 
parameter. In this mode, averaged data is calculated by 
(XX + YY) / 2 or (RR + LL) / 2. Other option is 'geometric', which 
is a conventional way of averaging in the field of single-dish 
data reduction. The averaged data is given by weighted average 
of XX and YY, or RR and LL. 

</example> 
<returns>void</returns></task>
</casaxml>
